{
 "schema": "bridge/bigdft-mapping/1",
 "profile_id": "fisicaro2023-case2-fixture",
 "profile_version": "0.0.1",
 "version": "1.0.0",
 "status": "draft",
 "settings": {
  "code": {
   "bigdft_value": "BigDFT",
   "status": "exact",
   "note": "same code"
  },
  "code_version": {
   "bigdft_value": null,
   "status": "unknown",
   "note": "source version unknown; the run records the BigDFT build used"
  },
  "xc_functional": {
   "bigdft_value": "ixc: PBE",
   "status": "exact",
   "note": "Libxc PBE"
  },
  "xc_per_element_exceptions": {
   "bigdft_value": "Mg: not offered",
   "status": "not_mappable",
   "note": "no LDA NLCC pseudopotential for Mg in this mapping; Mg claims are not planned"
  },
  "basis_or_grid": {
   "bigdft_value": "hgrids from the template convergence ladder; rmult [6, 8]",
   "status": "approximated",
   "note": "grid not stated; hgrids scanned by preset; rmult [6,8] chosen (a 2026-10-05 IMLab test showed [5,8]->[6,8] moves the Al13^-1 gap by 2.9 meV and [6,8]->[7,9] by 0.65 meV)"
  },
  "pseudopotentials_or_projectors": {
   "bigdft_value": "per element, see elements",
   "status": "approximated",
   "note": "paper cites the GTH/Willand-2013 NLCC family; exact files unknown. SS (Saha 2015) NLCC files are used. Absolute energies are not comparable (a test run gave -63.31 Ha vs stored -26.67 Ha for Al13^-1); energy differences, gaps and degeneracies are expected to transfer"
  },
  "boundary_conditions": {
   "bigdft_value": "free (no cell in posinp)",
   "status": "exact",
   "note": "BigDFT free boundary conditions"
  },
  "spin_treatment": {
   "bigdft_value": "odd electrons: nspin 2, mpol 1; even: nspin 1",
   "status": "approximated",
   "note": "the paper does not state the moment for odd counts; the minimal moment is used"
  },
  "charge_states": {
   "bigdft_value": "dft.qcharge = structure charge + recipe charge offset",
   "status": "exact",
   "note": "explicit charge per run"
  },
  "smearing_or_electronic_temperature": {
   "bigdft_value": "none (zero temperature)",
   "status": "exact",
   "note": "matches the paper for every element offered (Mg not offered)"
  },
  "scf_convergence": {
   "bigdft_value": "gnrm_cv 1e-5",
   "status": "approximated",
   "note": "not stated; a typical BigDFT production value"
  },
  "geometry_relaxation_criterion": {
   "bigdft_value": null,
   "status": "not_applicable",
   "note": "no prototype claim relaxes a geometry"
  },
  "dispersion_correction": {
   "bigdft_value": "none",
   "status": "approximated",
   "note": "not mentioned in the paper; none applied"
  },
  "solvation": {
   "bigdft_value": null,
   "status": "not_applicable",
   "note": "vacuum"
  },
  "k_points": {
   "bigdft_value": null,
   "status": "not_applicable",
   "note": "free boundary conditions"
  },
  "structure_source": {
   "bigdft_value": "canonical structures from the registry, verified against the agent's data by hash",
   "status": "exact",
   "note": "authority: Materials Cloud Archive j7hwv-81q79"
  }
 },
 "elements": {
  "Al": {
   "status": "approximated",
   "ixc": "PBE",
   "psp_file": "psp/psppar.Al.yaml",
   "psp_sha256": "b72340e5ee6d7e7fb63e260c952b544ee3114da8b20648c4a708652a306457d6",
   "psp_source": "PyBigDFT BigDFT/Database/psppar/SS (bigdft-suite commit e28ea49a81430c7bd369b0836a49d298811d85c3), 'generated by Saha,2015', HGH-K + NLCC, PBE (XC -101130)",
   "valence_electrons": 3,
   "note": "reproduced the Al13^-1 gap and degeneracy in a 2026-10-05 IMLab test"
  },
  "Si": {
   "status": "approximated",
   "ixc": "PBE",
   "psp_file": "psp/psppar.Si.yaml",
   "psp_sha256": "168ab62c7eb787e1647bede9889b1d3557ddd1dec5e405f277ad53738ef98a9f",
   "psp_source": "PyBigDFT BigDFT/Database/psppar/SS (bigdft-suite commit e28ea49a81430c7bd369b0836a49d298811d85c3), 'generated by Saha,2015', HGH-K + NLCC, PBE (XC -101130)",
   "valence_electrons": 4,
   "note": "untested"
  },
  "Mg": {
   "status": "not_mappable",
   "note": "paper uses LDA for Mg; no LDA NLCC file available in this mapping"
  },
  "Na": {
   "status": "not_mappable",
   "note": "no pseudopotential file available in this mapping"
  },
  "Ge": {
   "status": "not_mappable",
   "note": "no pseudopotential file available in this mapping"
  }
 },
 "spin_rule": "odd_electrons_collinear_minimal_moment",
 "dft_defaults": {
  "rmult": [
   6.0,
   8.0
  ],
  "gnrm_cv": 1e-05,
  "itermax": 100,
  "nrepmax": 3
 },
 "virtual_orbitals": {
  "norbv": 8,
  "nvirt": 8,
  "itermax_virt": 200,
  "gnrm_cv_virt": 1e-05
 },
 "tolerance_overrides": [],
 "reviewers": []
}